{
  "$schema": "tower-schema.json",
  "name": "Chapter 1-2 Tactical tower NEW",
  "info": {
    "atk": 50,
    "def": 0,
    "hp": 1000,
    "bronzeMedal": 0,
    "silverMedal": 0,
    "goldMedal": 0,
    "platinumMedal": 0,
    "diamondMedal": 0,
    "moonMedal": 0
  },
  "enemies": [
    {
      "type": "Burgeoner",
      "level": 5,
      "name": "Junior Burgeoner",
      "hp": 2500,
      "atk": 100,
      "def": 0,
      "exp": 20,
      "drop": ""
    },
    {
      "type": "Burgeoner",
      "level": 9,
      "name": "Burgeoner",
      "hp": 3000,
      "atk": 300,
      "def": 0,
      "exp": 50,
      "drop": ""
    },
    {
      "type": "Burgeoner",
      "level": 30,
      "name": "Master Burgeoner",
      "hp": 18000,
      "atk": 1000,
      "def": 300,
      "exp": 470,
      "drop": ""
    },
    {
      "type": "Fighter",
      "level": 1,
      "name": "Junior Fighter",
      "hp": 200,
      "atk": 100,
      "def": 0,
      "exp": 2,
      "drop": "Guard piece"
    },
    {
      "type": "Fighter",
      "level": 3,
      "name": "Fighter",
      "hp": 300,
      "atk": 200,
      "def": 0,
      "exp": 5,
      "drop": "Guard piece"
    },
    {
      "type": "Fighter",
      "level": 6,
      "name": "Elder Fighter",
      "hp": 600,
      "atk": 300,
      "def": 100,
      "exp": 10,
      "drop": "Guard gem"
    },
    {
      "type": "Fighter",
      "level": 11,
      "name": "Great Fighter",
      "hp": 1000,
      "atk": 400,
      "def": 200,
      "exp": 18,
      "drop": "Guard gem"
    },
    {
      "type": "Fighter",
      "level": 17,
      "name": "Fine Fighter",
      "hp": 2000,
      "atk": 700,
      "def": 300,
      "exp": 30,
      "drop": "Guard potion"
    },
    {
      "type": "Fighter",
      "level": 36,
      "name": "General Fighter",
      "hp": 5500,
      "atk": 1200,
      "def": 600,
      "exp": 70,
      "drop": "Guard card"
    },
    {
      "type": "Ranger",
      "level": 3,
      "name": "Junior Ranger",
      "hp": 200,
      "atk": 100,
      "def": 0,
      "exp": 2,
      "drop": "Red potion"
    },
    {
      "type": "Ranger",
      "level": 6,
      "name": "Ranger",
      "hp": 200,
      "atk": 200,
      "def": 100,
      "exp": 5,
      "drop": "Red potion"
    },
    {
      "type": "Ranger",
      "level": 13,
      "name": "Elder Ranger",
      "hp": 800,
      "atk": 300,
      "def": 100,
      "exp": 10,
      "drop": "Blue potion"
    },
    {
      "type": "Ranger",
      "level": 16,
      "name": "Great Ranger",
      "hp": 800,
      "atk": 600,
      "def": 100,
      "exp": 18,
      "drop": "Blue potion"
    },
    {
      "type": "Ranger",
      "level": 19,
      "name": "Fine Ranger",
      "hp": 800,
      "atk": 800,
      "def": 200,
      "exp": 30,
      "drop": "Blue potion"
    },
    {
      "type": "Ranger",
      "level": 23,
      "name": "Master Ranger",
      "hp": 2000,
      "atk": 1000,
      "def": 100,
      "exp": 47,
      "drop": "Life potion"
    },
    {
      "type": "Ranger",
      "level": 32,
      "name": "General Ranger",
      "hp": 2000,
      "atk": 1600,
      "def": 200,
      "exp": 70,
      "drop": "Life potion"
    },
    {
      "type": "Ranger",
      "level": 36,
      "name": "Legendary Ranger",
      "hp": 3000,
      "atk": 2200,
      "def": 400,
      "exp": 100,
      "drop": "Heavenly potion"
    },
    {
      "type": "Shadow",
      "level": 3,
      "name": "Junior Shadow",
      "hp": 300,
      "atk": 200,
      "def": 0,
      "exp": 4,
      "drop": "Yellow key"
    },
    {
      "type": "Shadow",
      "level": 8,
      "name": "Shadow",
      "hp": 500,
      "atk": 300,
      "def": 100,
      "exp": 16,
      "drop": "Blue key"
    },
    {
      "type": "Shadow",
      "level": 14,
      "name": "Elder Shadow",
      "hp": 600,
      "atk": 700,
      "def": 100,
      "exp": 36,
      "drop": "Crimson key"
    },
    {
      "type": "Shadow",
      "level": 22,
      "name": "Great Shadow",
      "hp": 1200,
      "atk": 1200,
      "def": 200,
      "exp": 64,
      "drop": "Violet key"
    },
    {
      "type": "Shadow",
      "level": 50,
      "name": "Fine Shadow",
      "hp": 5000,
      "atk": 3000,
      "def": 0,
      "exp": 200,
      "drop": "Yellow key"
    },
    {
      "type": "Shadow",
      "level": 60,
      "name": "Master Shadow",
      "hp": 7000,
      "atk": 4000,
      "def": 100,
      "exp": 250,
      "drop": "Blue key"
    },
    {
      "type": "Slasher",
      "level": 1,
      "name": "Junior Slasher",
      "hp": 100,
      "atk": 200,
      "def": 0,
      "exp": 2,
      "drop": "Power piece"
    },
    {
      "type": "Slasher",
      "level": 3,
      "name": "Slasher",
      "hp": 200,
      "atk": 300,
      "def": 0,
      "exp": 5,
      "drop": "Power piece"
    },
    {
      "type": "Slasher",
      "level": 6,
      "name": "Elder Slasher",
      "hp": 400,
      "atk": 500,
      "def": 0,
      "exp": 10,
      "drop": "Power gem"
    },
    {
      "type": "Slasher",
      "level": 11,
      "name": "Great Slasher",
      "hp": 800,
      "atk": 600,
      "def": 100,
      "exp": 18,
      "drop": "Power gem"
    },
    {
      "type": "Slasher",
      "level": 17,
      "name": "Fine Slasher",
      "hp": 1000,
      "atk": 1000,
      "def": 200,
      "exp": 30,
      "drop": "Power potion"
    }
  ],
  "items": {},
  "levels": [
    {
      "atkAdd": 0,
      "atkMul": 0,
      "defAdd": 0,
      "defMul": 0,
      "hpAdd": 10,
      "hpMul": 0,
      "blueKey": 0,
      "crimsonKey": 0,
      "yellowKey": 0
    }
  ],
  "rooms": {
    "standard": [
      {
        "name": "1F-Chaotic layer",
        "tiles": [
          [
            {
              "type": "empty"
            },
            {
              "type": "empty"
            },
            {
              "type": "empty"
            },
            {
              "type": "empty"
            },
            {
              "type": "empty"
            },
            {
              "type": "empty"
            },
            {
              "type": "empty"
            },
            {
              "type": "empty"
            },
            {
              "type": "empty"
            },
            {
              "type": "empty"
            },
            {
              "type": "empty"
            },
            {
              "type": "empty"
            },
            {
              "type": "empty"
            },
            {
              "type": "empty"
            },
            {
              "type": "empty"
            }
          ],
          [
            {
              "type": "empty"
            },
            {
              "type": "empty"
            },
            {
              "type": "empty"
            },
            {
              "type": "empty"
            },
            {
              "type": "empty"
            },
            {
              "type": "empty"
            },
            {
              "type": "empty"
            },
            {
              "type": "empty"
            },
            {
              "type": "empty"
            },
            {
              "type": "empty"
            },
            {
              "type": "empty"
            },
            {
              "type": "empty"
            },
            {
              "type": "empty"
            },
            {
              "type": "empty"
            },
            {
              "type": "empty"
            }
          ],
          [
            {
              "type": "empty"
            },
            {
              "type": "empty"
            },
            {
              "type": "empty"
            },
            {
              "type": "empty"
            },
            {
              "type": "empty"
            },
            {
              "type": "empty"
            },
            {
              "type": "empty"
            },
            {
              "type": "empty"
            },
            {
              "type": "empty"
            },
            {
              "type": "empty"
            },
            {
              "type": "empty"
            },
            {
              "type": "empty"
            },
            {
              "type": "empty"
            },
            {
              "type": "empty"
            },
            {
              "type": "empty"
            }
          ],
          [
            {
              "type": "empty"
            },
            {
              "type": "empty"
            },
            {
              "type": "empty"
            },
            {
              "type": "empty"
            },
            {
              "type": "empty"
            },
            {
              "type": "empty"
            },
            {
              "type": "empty"
            },
            {
              "type": "empty"
            },
            {
              "type": "empty"
            },
            {
              "type": "empty"
            },
            {
              "type": "empty"
            },
            {
              "type": "empty"
            },
            {
              "type": "empty"
            },
            {
              "type": "empty"
            },
            {
              "type": "empty"
            }
          ],
          [
            {
              "type": "empty"
            },
            {
              "type": "empty"
            },
            {
              "type": "empty"
            },
            {
              "type": "empty"
            },
            {
              "type": "empty"
            },
            {
              "type": "empty"
            },
            {
              "type": "empty"
            },
            {
              "type": "empty"
            },
            {
              "type": "empty"
            },
            {
              "type": "empty"
            },
            {